,tweet_id,user_id,user_name,text,time,retweets,favorited,place,geo
0,1043284499562262528,32915646,TheOneCalledEli,"@FedExHelp I have a package from the UK that was due to arrive in CA this morning, but it seems like due to a customs issue it's stuck in TN. I've been on hold +20 mins to try to reach the rep (Taylor) who left a message about it. How long should I anticipate being on hold? 😢",Fri Sep 21 23:43:02 +0000 2018,0,0,,
1,1043296278786891776,32915646,TheOneCalledEli,are you shitting me???? I spent over an hour on hold and then the @FedEx @FedExHelp phone line told me the number I'm trying to reach is unavailable??? oh that's nice. https://t.co/ZROxs2Tbht,Sat Sep 22 00:29:51 +0000 2018,0,1,,
2,1043301077347696641,952293073,FedExHelp,@TheOneCalledEli @TheOneCalledEli: I'll be delighted to check on your shipment! Would you send the tracking # and delivery address? Sonia,Sat Sep 22 00:48:55 +0000 2018,0,0,,
3,1043301970511974401,32915646,TheOneCalledEli,"@FedExHelp Thank you Sonia, just sent you a  Direct Message!",Sat Sep 22 00:52:28 +0000 2018,0,0,,
4,1043315001857982465,32915646,TheOneCalledEli,"waiting on a DM reply from @FedExHelp. you're breaking my heart, Sonia. you made it sound like you genuinely wanted to help.",Sat Sep 22 01:44:14 +0000 2018,0,1,,
5,1043315521356292096,952293073,FedExHelp,"@TheOneCalledEli @TheOneCalledEli: Your shipment is currently in Memphis at our Hub, was due to arrive today, Friday and appears to have an operational delay. Please continue to track this shipment, will update to deliver on next business day Monday. Am sorry for delays.",Sat Sep 22 01:46:18 +0000 2018,0,0,,
6,1043315923682091009,32915646,TheOneCalledEli,"@FedExHelp Can I please ask what an ""operational delay"" means? My concern is that there may be issues with customs preventing the package from traveling further into the states. Do you know who I could contact to ascertain if this is an issue, please?",Sat Sep 22 01:47:54 +0000 2018,0,0,,
