,tweet_id,user_id,user_name,text,time,retweets,favorited,place,geo
0,1043368396899794944,368047980,absurdist,U bums @AppleSupport @UPSHelp Why is it in Kentucky? https://t.co/VUrAHpOPjp,Sat Sep 22 05:16:25 +0000 2018,0,0,,
1,1043374081427615744,271516607,UPSHelp,"@absurdist I'm sorry that you feel this way. Your package has been scheduled for delivery by the end of the day on Saturday, 9/22/18. Please feel free to provide your name, address and phone number via a DM if you require additional assistance. Thank you. ^KD https://t.co/wKJHDXWGRQ",Sat Sep 22 05:39:00 +0000 2018,0,0,,
2,1043653009098436608,368047980,absurdist,"@UPSHelp Y’all said i would have it by end of business today, yesterday now you’re telling me that it’s in Hong Kong? What in the world is going on with this?? https://t.co/oXMKYzd2eJ",Sun Sep 23 00:07:22 +0000 2018,0,0,,
3,1044354652223860737,368047980,absurdist,Can y’all explain this? @UPSHelp @AppleSupport this is getting ridiculous. https://t.co/wLIXSX1Dx9,Mon Sep 24 22:35:26 +0000 2018,0,0,,
4,1044357685767012353,271516607,UPSHelp,"@absurdist I can certainly see how this would be frustrating to not have this package delivered yet. If you would like us to look into this please DM us your tracking number, complete address, and phone number. ^AC",Mon Sep 24 22:47:30 +0000 2018,0,0,,
