,tweet_id,user_id,user_name,text,time,retweets,favorited,place,geo
0,1044714122762493952,234494371,Chris_McNabb,"@FedExHelp Hey, FedEx, why do my Blue Apron boxes keep arriving at my house so damaged I have to throw everything out? It’s now four out of our last six. Does our route driver hate us? Should we just give up on Blue Apron because of you?",Tue Sep 25 22:23:51 +0000 2018,0,0,,
1,1044714674112122882,234494371,Chris_McNabb,"@FedExHelp @blueapron Blue Apron, we love you, but FedEx keeps delivering mauled boxes that have to be thrown out. It’s a shame. Great product, but four out of our last six packages were so damaged they had to be thrown out. Is there another delivery option?",Tue Sep 25 22:26:02 +0000 2018,0,0,,
2,1044715401597386752,234494371,Chris_McNabb,"@FedExHelp @blueapron Thanks, FedEx! https://t.co/DOzc6W07iW",Tue Sep 25 22:28:56 +0000 2018,0,0,,
3,1044725231192018944,952293073,FedExHelp,"@Chris_McNabb @Chris_McNabb Christopher, hello this is Joe. I do apologize on behalf of Fedex about your package deliveries. This is not the experience we want to provide.Please DM @FedExHelp your name, delivery address, tracking &amp; phone numbers. I would be happy to look into this.
~joe",Tue Sep 25 23:07:59 +0000 2018,0,0,,
