,tweet_id,user_id,user_name,text,time,retweets,favorited,place,geo
0,1029502101846515712,727234359611129857,Galen_Henseler,"Update on ""Where in the world is my laptop"". @Klarna was able to get me a tracking number yesterday, after being told on Friday by @Microsoft that my order hadn't shipped. Best part is @FedEx says that the package was delivered on the 3rd. But I still have yet to get anything.",Tue Aug 14 22:56:42 +0000 2018,0,0,,
1,1030230914112970758,727234359611129857,Galen_Henseler,"@MicrosoftHelps @Microsoft it’s been two weeks since my package was delivered according to @FedEx but I still see my order as “Awaiting Fulfillment”. Been on hold for over half an hour trying to talk to someone. Missing a package worth over $2,000 is kind of a big deal.",Thu Aug 16 23:12:45 +0000 2018,0,0,,
2,1031700844079538176,727234359611129857,Galen_Henseler,"@Klarna doesn’t require a signature on a $2,000+ package. @FedEx delivers to the wrong apartment. @Microsoft sends shipping confirmation email TWO WEEKS after the package is delivered. But I STILL can’t get a refund. #poorservice #NeverAgain",Tue Aug 21 00:33:43 +0000 2018,0,0,,
3,1032094069218897921,727234359611129857,Galen_Henseler,"It's been over a week since I opened a lost package case with @FedEx &amp; a support case with @Microsoft/@MicrosoftHelps about a missing laptop worth over $2,400. Still waiting on a resolution. Not having a computer is going to make it difficult to start MBA classes on Monday. #HELP",Wed Aug 22 02:36:16 +0000 2018,1,0,,
4,1038451496747073536,727234359611129857,Galen_Henseler,"Almost two months later and there is still no word from @Microsoft/@MicrosoftHelps or @FedEx/@FedExHelp about a missing package worth almost $2,500. Simply that they are still looking into it and will get back to me as soon as they know more. TWO MONTHS. #badcustomerservice",Sat Sep 08 15:38:24 +0000 2018,2,1,,
5,1043625110312181760,727234359611129857,Galen_Henseler,RT @Galen_Henseler: Almost two months later and there is still no word from @Microsoft/@MicrosoftHelps or @FedEx/@FedExHelp about a missing…,Sat Sep 22 22:16:30 +0000 2018,2,0,,
6,1043625192382029825,727234359611129857,Galen_Henseler,RT @Galen_Henseler: It's been over a week since I opened a lost package case with @FedEx &amp; a support case with @Microsoft/@MicrosoftHelps a…,Sat Sep 22 22:16:50 +0000 2018,1,0,,
7,1043625590937464833,727234359611129857,Galen_Henseler,"Should also say that if I had to guess @FedEx delivered the package to the wrong apartment. However, @Microsoft didn’t send a shipping notification email until 10 days after the package was supposably delivered so verifying the delivery location was near impossible.",Sat Sep 22 22:18:25 +0000 2018,0,0,,
8,1043682132751732736,952293073,FedExHelp,"@Galen_Henseler @Galen_Henseler Hello, this is Joe. I do apologize on behalf of Fedex for this package and delivery issue. . Please DM @FedExHelp recipient name, delivery address, tracking &amp; phone numbers. I would be happy to research this.
~joe",Sun Sep 23 02:03:05 +0000 2018,0,0,,
