,tweet_id,user_id,user_name,text,time,retweets,favorited,place,geo
0,1043298631179280384,14947355,jdfwarrior,Every year @FedEx is supposed to deliver my new iPhone and every year I have issues with FedEx. 7:38pm and still no package.,Sat Sep 22 00:39:11 +0000 2018,0,0,78b14d91cd0a2a40,
1,1043306025619779585,952293073,FedExHelp,"@jdfwarrior Hello David, this is Rochelle. I am very sorry your package has not been delivered. Would you like me to look into this for you?  Please verify your full name, address, tracking number, phone number and email address. 
Thank you.",Sat Sep 22 01:08:34 +0000 2018,0,0,,
2,1043310393534361600,14947355,jdfwarrior,"@FedExHelp I’ve already called 2-3 times today and was gauranteed numerous times it would be here by 8, which, it wasn’t. So, I don’t want to go through that whole spiel again.  It’s just going to make me more mad than I already am.",Sat Sep 22 01:25:56 +0000 2018,0,0,78b14d91cd0a2a40,
3,1043355949212291072,14947355,jdfwarrior,"@ngocphamm @Apple @FedEx @tim_cook Well my thing is too though, if I wanted to drive to the local and office and pick it up, what’s the point in someone paying for delivery?! If I wanted to drive somewhere to get it, I would have gone to the Apple Store today instead of preordering",Sat Sep 22 04:26:57 +0000 2018,0,0,78b14d91cd0a2a40,
