,tweet_id,user_id,user_name,text,time,retweets,favorited,place,geo
0,1043214147083743233,2202513369,lmcmike,@FedEx Not happy with your service.  Broke my dishes and now you won’t pay.  Hope it makes you feel better to keep your measly $56.  I’ll not use you to ship anything of value going forward.  And telling all my friends.,Fri Sep 21 19:03:29 +0000 2018,0,0,,
1,1043218421817716736,952293073,FedExHelp,"@lmcmike Hi Lynne, this is Andre. I apologize for the inconvenience. I will be happy to research this for you. Please DM your tracking number, delivery address, and contact number.",Fri Sep 21 19:20:28 +0000 2018,0,0,,
2,1044229392610865153,952293073,FedExHelp,"@lmcmike Hi, this is Fatimah.  Please follow @FedExHelp so I may respond to your request.  Thank you.",Mon Sep 24 14:17:42 +0000 2018,0,0,,
3,1044530701251547136,2202513369,lmcmike,And again @FedExHelp let’s me down.  No response after DM.  Really???? https://t.co/cTkVdsBVEW,Tue Sep 25 10:15:00 +0000 2018,0,0,,
4,1044539048667357184,952293073,FedExHelp,"@lmcmike Hello, my name is Bobby. I am sorry for the issues you have experienced with your shipment. I have received your DM. Please follow @FedExHelp so that I can respond.",Tue Sep 25 10:48:10 +0000 2018,0,0,,
