,tweet_id,user_id,user_name,text,time,retweets,favorited,place,geo
0,935063057134440448,243429481,RoMartin6,"@FedExEurope A word with your drivers wouldn't go a miss ...skipping the queue &amp; disrespecting drivers daily, up Yellow Road, into the wrong lane to skip ...we're all in a hurry😡 https://t.co/xX7hzZcWU1",Mon Nov 27 08:29:40 +0000 2017,0,0,,
1,935063499063091200,243429481,RoMartin6,@FedExEurope Maybe ask your drivers to be more respectful on the road ...skipping the traffic queue is so annoying ..we're all busy https://t.co/ks5SAHIlIG,Mon Nov 27 08:31:25 +0000 2017,0,0,,
2,935561234577059840,243429481,RoMartin6,@FedExHelpEU It's in the photo,Tue Nov 28 17:29:14 +0000 2017,0,0,,
3,935903358149386240,243429481,RoMartin6,"@FedExHelpEU Sure, here's what happens most mornings (8am ish) 2/3 vans come up Yellow Rd, Whitehall. Cross to Beaumont Rd pass all traffic by staying on right turn lane &amp; then force their way into the right hand lane to go straight, not a once off its a regular occurrence &amp; it's annoying",Wed Nov 29 16:08:43 +0000 2017,0,0,,
4,935903750392336384,243429481,RoMartin6,@FedExHelpEU Correction; Forcing their way onto LEFT hand lane (sorry),Wed Nov 29 16:10:17 +0000 2017,0,0,,
5,1044125397733056513,243429481,RoMartin6,Here we go with @FedEx bad driving AGAIN TWO vans cutting in on Beaumont Rd from Yellow Rd this morning at 8.08AM @FedExHelp @FedExEurope https://t.co/jVWA44JD4l,Mon Sep 24 07:24:28 +0000 2018,0,0,,
