,tweet_id,user_id,user_name,text,time,retweets,favorited,place,geo
0,1043663038224769025,14833295,zachdevine,"@UPS @UPSHelp your service has really gone down hill. Ive had 2 thing over past 6 months delivered by you. One dropped off at the wrong address, the other on the truck for 12 hours now and still not delivered. #sad #usps4life",Sun Sep 23 00:47:13 +0000 2018,0,0,,
1,1043664998260781057,271516607,UPSHelp,"@zachdevine That does sound upsetting. I'd like to look into this delivery for you. Please DM your tracking number, contact information and address. ^KS https://t.co/wKJHDXWGRQ",Sun Sep 23 00:55:00 +0000 2018,0,0,,
2,1043717165977878533,14833295,zachdevine,"@UPSHelp Yeah, then I DM you about it and.... No reply.  Im never using ups again. I'll pay extra to avoid you.",Sun Sep 23 04:22:18 +0000 2018,0,0,,
3,1044356393984299009,14833295,zachdevine,"Ok @UPS @UPSHelp, another 10+ hrs of ""out for delivery"" and no package. What's the excuse going to be this time?",Mon Sep 24 22:42:22 +0000 2018,0,1,,
4,1044364003760369665,271516607,UPSHelp,@zachdevine The tracking shows this package was delivered as of 5:53 PM. Please confirm that you've received your package! ^SK https://t.co/wKJHDXWGRQ,Mon Sep 24 23:12:36 +0000 2018,0,0,,
